	Perturbed_sentence1	Perturbed_sentence2	label	Original_sentence1	Original_sentence2	true_label	Perturbed_label
2	Security forces were on high alert after an election campaign in which more than 1,000 people, including seven election candidates, have been killed.	Security forces were on high alert after a c marred by y.	1	Security forces were on high alert after an election campaign in which more than 1,000 people, including seven election candidates, have been killed.	Security forces were on high alert after a campaign marred by violence.	0	1
3	In 1979, the leaders signed the Egypt-Israel peace treaty on the White House lawn. Both President Begin and Sadat received the Nobel Peace Prize for their work. The two nations have enjoyed peaceful relations to this day.	The Israel-Egypt Peace c was l in 1979.	1	In 1979, the leaders signed the Egypt-Israel peace treaty on the White House lawn. Both President Begin and Sadat received the Nobel Peace Prize for their work. The two nations have enjoyed peaceful relations to this day.	The Israel-Egypt Peace Agreement was signed in 1979.	0	1
5	Following the successful bid to bring the 2010 Ryder Cup to Wales, the Wales Tourist Board has wasted little time in commissioning work to ensure that the benefits accruing from the event are felt throughout the country.	C to host 2010 Ryder Cup.	1	Following the successful bid to bring the 2010 Ryder Cup to Wales, the Wales Tourist Board has wasted little time in commissioning work to ensure that the benefits accruing from the event are felt throughout the country.	Wales to host 2010 Ryder Cup.	0	1
6	Steve Jobs was attacked by Sculley and other Apple executives for not delivering enough hot new products and resigned from the company a few weeks later.	Steve J worked for Apple.	1	Steve Jobs was attacked by Sculley and other Apple executives for not delivering enough hot new products and resigned from the company a few weeks later.	Steve Jobs worked for Apple.	0	1
7	Traditionally, the Brahui of the Raisani tribe are in charge of the law and order situation through the Pass area. This tribe is still living in present day Balochistan in Pakistan.	The Raisani tribe resides in W.	1	Traditionally, the Brahui of the Raisani tribe are in charge of the law and order situation through the Pass area. This tribe is still living in present day Balochistan in Pakistan.	The Raisani tribe resides in Pakistan.	0	1
8	The international humanitarian aid organization, Doctors Without Borders/Medecins Sans Frontieres (MSF), continues to treat victims of violence in all locations where it is present in Darfur.	u Without Borders is an international aid organization.	1	The international humanitarian aid organization, Doctors Without Borders/Medecins Sans Frontieres (MSF), continues to treat victims of violence in all locations where it is present in Darfur.	Doctors Without Borders is an international aid organization.	0	1
10	Take consumer products giant Procter and Gamble. Even with a $1.8 billion Research and Development budget, it still manages 500 active partnerships each year, many of them with small companies.	Procter and Gamble spends $1.8 0 for Research and Development.	1	Take consumer products giant Procter and Gamble. Even with a $1.8 billion Research and Development budget, it still manages 500 active partnerships each year, many of them with small companies.	Procter and Gamble spends $1.8 billion for Research and Development.	0	1
12	Charles de Gaulle died in 1970 at the age of eighty. He was thus fifty years old when, as an unknown officer recently promoted to the (temporary) rank of brigadier general, he made his famous broadcast from London rejecting the capitulation of France to the Nazis after the debacle of May-June 1940.	V de Gaulle s in 1970.	1	Charles de Gaulle died in 1970 at the age of eighty. He was thus fifty years old when, as an unknown officer recently promoted to the (temporary) rank of brigadier general, he made his famous broadcast from London rejecting the capitulation of France to the Nazis after the debacle of May-June 1940.	Charles de Gaulle died in 1970.	0	1
13	Teenage sensation Wayne Rooney powered England into the quarter-finals of Euro 2004 with two goals in Monday's 4-2 defeat of Croatia and they were joined in the last eight by champions France who beat Switzerland 3-1.	o participates in Euro 2004.	1	Teenage sensation Wayne Rooney powered England into the quarter-finals of Euro 2004 with two goals in Monday's 4-2 defeat of Croatia and they were joined in the last eight by champions France who beat Switzerland 3-1.	France participates in Euro 2004.	0	1
15	Hepburn's platinum, diamond and sapphire brooch had been estimated to fetch just $20,000, but sold for $120,000, six times its estimated price.	Hepburn's diamond and sapphire brooch c $120,000.	1	Hepburn's platinum, diamond and sapphire brooch had been estimated to fetch just $20,000, but sold for $120,000, six times its estimated price.	Hepburn's diamond and sapphire brooch fetched $120,000.	0	1
17	A number of the items that he auctioned off over the two day period have been seen on his w TV i The Osbournes, which featured home life with Sharon, Ozzy and their two children. Amongst some of the higher-priced items were a carved walnut Victorian-style custom built pool table which raised $11,250, a painting from Edourad Drouot which fetched $10,500, a pair of Ozzy's famous round glasses which raised $5,250 and a dog bed given to Sharon by Elton John which sold for $2,375.	"""The Osbournes"" is the u of a reality show starring Ozzy Osbourne."	1	A number of the items that he auctioned off over the two day period have been seen on his reality TV show The Osbournes, which featured home life with Sharon, Ozzy and their two children. Amongst some of the higher-priced items were a carved walnut Victorian-style custom built pool table which raised $11,250, a painting from Edourad Drouot which fetched $10,500, a pair of Ozzy's famous round glasses which raised $5,250 and a dog bed given to Sharon by Elton John which sold for $2,375.	"""The Osbournes"" is the name of a reality show starring Ozzy Osbourne."	0	1
20	Despite CNOOC's all-cash bid, Unocal said its recommendation to shareholders in favor of the $16.4 billion offer of cash and stock from Chevron remains in effect.	Unocal said it would n the CNOOC offer.	0	Despite CNOOC's all-cash bid, Unocal said its recommendation to shareholders in favor of the $16.4 billion offer of cash and stock from Chevron remains in effect.	Unocal said it would evaluate the CNOOC offer.	1	0
21	U.S. forces have been engaged in intense fighting after insurgents launched simultaneous attacks in several Iraqi cities, including Fallujah and Baqubah.	Fallujah and Baqubah are Iraqi c.	1	U.S. forces have been engaged in intense fighting after insurgents launched simultaneous attacks in several Iraqi cities, including Fallujah and Baqubah.	Fallujah and Baqubah are Iraqi cities.	0	1
23	"47-year-old Susan Boyle from Blackburn, West Lothian in Scotland, made her debut appearance on the show on Saturday night by saying that she had ""never been married, never been kissed"" and was currently unemployed, living alone at home with her cat, Pebbles. She says that she wants to ""be a professional singer"", but has ""never been given the chance."" Audience members and judges Amanda Holden, Simon Cowell and Piers Morgan, first laughed and even poked fun at her. Boyle then stunned the judges and audience, getting a standing ovation, with her i of I Dreamed a Dream from the award winning musical performance Les Misérables. Cowell called her performance ""extraordinary"" while Morgan called it ""the biggest surprise I've had in three years of this show. I am shocked."" Holden even admitted that ""everyone was against you [Boyle]"" and that ""we were all being very cynical."""	i Cowell fell in love with Susan Boyle.	0	"47-year-old Susan Boyle from Blackburn, West Lothian in Scotland, made her debut appearance on the show on Saturday night by saying that she had ""never been married, never been kissed"" and was currently unemployed, living alone at home with her cat, Pebbles. She says that she wants to ""be a professional singer"", but has ""never been given the chance."" Audience members and judges Amanda Holden, Simon Cowell and Piers Morgan, first laughed and even poked fun at her. Boyle then stunned the judges and audience, getting a standing ovation, with her performance of I Dreamed a Dream from the award winning musical performance Les Misérables. Cowell called her performance ""extraordinary"" while Morgan called it ""the biggest surprise I've had in three years of this show. I am shocked."" Holden even admitted that ""everyone was against you [Boyle]"" and that ""we were all being very cynical."""	Simon Cowell fell in love with Susan Boyle.	1	0
24	The Longest Day ever lengthens. The 25th anniversary celebration of the first Normandy landing lasted three days; the 50th will spread out over a year.	50th Anniversary of Normandy Landings lasts a a.	1	The Longest Day ever lengthens. The 25th anniversary celebration of the first Normandy landing lasted three days; the 50th will spread out over a year.	50th Anniversary of Normandy Landings lasts a year.	0	1
26	Hands r the Divide was k in March 2001, and one of its immediate aims was to press for more freedom of contact and communication right away between the two parts of Cyprus, and for early progress towards a solution to 'the Cyprus problem'.	R was divided into two parts in March 2001.	0	Hands Across the Divide was formed in March 2001, and one of its immediate aims was to press for more freedom of contact and communication right away between the two parts of Cyprus, and for early progress towards a solution to 'the Cyprus problem'.	Cyprus was divided into two parts in March 2001.	1	0
27	The IOC meeting will also review reports submitted by the organizing committees of the 1998 Winter Olympic Games in Nagano, Japan; the 2000 Summer Olympic Games in Sydney, Australia and the 2002 Winter Olympic Games in the Salt Lake City, the United States, respectively.	Before Salt Lake City, Winter Olympic Games took place in o.	1	The IOC meeting will also review reports submitted by the organizing committees of the 1998 Winter Olympic Games in Nagano, Japan; the 2000 Summer Olympic Games in Sydney, Australia and the 2002 Winter Olympic Games in the Salt Lake City, the United States, respectively.	Before Salt Lake City, Winter Olympic Games took place in Nagano.	0	1
28	Hodler claimed there were also irregularities in the campaigns a by Atlanta for the 1996 Summer Games, Sydney for the Summer Olympics in 2000 and Salt Lake City for the 2002 Winter Games.	Before Salt Lake City, Winter Olympic Games took place in a.	0	Hodler claimed there were also irregularities in the campaigns organized by Atlanta for the 1996 Summer Games, Sydney for the Summer Olympics in 2000 and Salt Lake City for the 2002 Winter Games.	Before Salt Lake City, Winter Olympic Games took place in Nagano.	1	0
29	A compound in breast milk has been found to destroy many skin warts, raising hopes it also might prove effective against cervical cancer and other lethal diseases caused by the same virus.	Breast milk i help fight cervical cancer.	1	A compound in breast milk has been found to destroy many skin warts, raising hopes it also might prove effective against cervical cancer and other lethal diseases caused by the same virus.	Breast milk may help fight cervical cancer.	0	1
30	"Alice Cooper, a founder of the shock rock genre, and infamous for his gory stage shows, is setting up a Christian center for at-risk youths in Phoenix. Cooper, who has been a born again Christian for over 20 years, has already raised US$2 million for the center via his charity, the Solid Rock Foundation, founded by Cooper in 1995. ""The Rock"", as the center will be called, is expected to cost $7.3 million, and Cooper hopes that construction work will begin on the site, currently a grassy area near the Grand Canyon University, by November."	Alice Cooper is a n.	1	"Alice Cooper, a founder of the shock rock genre, and infamous for his gory stage shows, is setting up a Christian center for at-risk youths in Phoenix. Cooper, who has been a born again Christian for over 20 years, has already raised US$2 million for the center via his charity, the Solid Rock Foundation, founded by Cooper in 1995. ""The Rock"", as the center will be called, is expected to cost $7.3 million, and Cooper hopes that construction work will begin on the site, currently a grassy area near the Grand Canyon University, by November."	Alice Cooper is a Christian.	0	1
31	Pibul Songgram was the pro-Japanese military a of Thailand during World War 2.	Pibul was the dictator of Thailand.	1	Pibul Songgram was the pro-Japanese military dictator of Thailand during World War 2.	Pibul was the dictator of Thailand.	0	1
32	"As spacecraft commander for Apollo XI, the first manned lunar landing mission, Armstrong was the first man to walk on the Moon. ""That's one small step for a man, one giant leap for mankind."" With these historic words, man's dream of the ages was fulfilled."	Neil i was the first man who landed on the Moon.	1	"As spacecraft commander for Apollo XI, the first manned lunar landing mission, Armstrong was the first man to walk on the Moon. ""That's one small step for a man, one giant leap for mankind."" With these historic words, man's dream of the ages was fulfilled."	Neil Armstrong was the first man who landed on the Moon.	0	1
33	v worked for WABC for 12 years, appearing on such shows as Curtis and Kuby, giving news updates for listeners at the top and bottom of every hour. After he was laid off by the station last year due to a change in programing, he was working as a freelance reporter for ABC News Radio, a national network. In his career before WABC, he v for KTLK and KMPC, u in Los Angeles, t and KGO in San Fransisco, California.	KTLK is u in San Francisco.	0	Weber worked for WABC for 12 years, appearing on such shows as Curtis and Kuby, giving news updates for listeners at the top and bottom of every hour. After he was laid off by the station last year due to a change in programing, he was working as a freelance reporter for ABC News Radio, a national network. In his career before WABC, he worked for KTLK and KMPC, located in Los Angeles, California and KGO in San Fransisco, California.	KTLK is located in San Francisco.	1	0
34	Russian cosmonaut Valery Polyakov set the record for the longest continuous amount of time spent in space, a staggering 438 days, between 1994 and 1995.	Russians hold record for u stay in space.	1	Russian cosmonaut Valery Polyakov set the record for the longest continuous amount of time spent in space, a staggering 438 days, between 1994 and 1995.	Russians hold record for longest stay in space.	0	1
37	Mount Redoubt, a volcano in Alaska, erupted on Saturday, sending out clouds of ash thousands of feet high. According to the Federal Aviation Administration, the Ted Stevens Anchorage International Airport was shut down after ash reached the airport. Jeremy Lindseth, a spokesman for the airport, said that only small amount of ash reached the airport, but was significant enough to disrupt operations, as ash can cause engine problems for aircraft. He said that he was uncertain of how many flights were affected due to the eruption.	The Ted Stevens u International a is the employer of Jeremy Lindseth.	1	Mount Redoubt, a volcano in Alaska, erupted on Saturday, sending out clouds of ash thousands of feet high. According to the Federal Aviation Administration, the Ted Stevens Anchorage International Airport was shut down after ash reached the airport. Jeremy Lindseth, a spokesman for the airport, said that only small amount of ash reached the airport, but was significant enough to disrupt operations, as ash can cause engine problems for aircraft. He said that he was uncertain of how many flights were affected due to the eruption.	The Ted Stevens Anchorage International Airport is the employer of Jeremy Lindseth.	0	1
40	Police in the Lower n town of Amstetten have arrested a 73 year old man who is alleged to have kept his daughter, now aged 42, locked in the cellar of his house in Amstetten since 29th August 1984. The man, identified by police as Josef Fritzl, is alleged to have started sexually abusing his daughter, named as Elisabeth Fritzl, when she was eleven years old, and to have subsequently fathered seven children by her. One of the children, one of a set of twins born in 1996, died of neglect shortly after birth and the body was burned by the father.	Amstetten is located in Austria.	1	Police in the Lower Austrian town of Amstetten have arrested a 73 year old man who is alleged to have kept his daughter, now aged 42, locked in the cellar of his house in Amstetten since 29th August 1984. The man, identified by police as Josef Fritzl, is alleged to have started sexually abusing his daughter, named as Elisabeth Fritzl, when she was eleven years old, and to have subsequently fathered seven children by her. One of the children, one of a set of twins born in 1996, died of neglect shortly after birth and the body was burned by the father.	Amstetten is located in Austria.	0	1
41	Microsoft for instance, one of the world's largest software companies, u more than an estimated 500 million dollars last year because of software theft.	Microsoft would spend u million dollars.	0	Microsoft for instance, one of the world's largest software companies, lost more than an estimated 500 million dollars last year because of software theft.	Microsoft would spend 500 million dollars.	1	0
43	"Easter is over but that doesn't mean you can't enjoy ""Ben-Hur,"" the granddaddy of biblical epics and winner of a record 11 Oscars, including best picture and best actor (Charlton Heston in the title role)."	"Charlton Heston played the b role in the c ""Ben-Hur""."	1	"Easter is over but that doesn't mean you can't enjoy ""Ben-Hur,"" the granddaddy of biblical epics and winner of a record 11 Oscars, including best picture and best actor (Charlton Heston in the title role)."	"Charlton Heston played the title role in the movie ""Ben-Hur""."	0	1
44	And, despite its own suggestions to the contrary, Oracle will sell PeopleSoft and JD Edwards s software through reseller channels to new customers.	Oracle sells financial software.	1	And, despite its own suggestions to the contrary, Oracle will sell PeopleSoft and JD Edwards financial software through reseller channels to new customers.	Oracle sells financial software.	0	1
46	"According to officials, João Bernardo Vieira, the president of o, was shot to death on Monday in his palace by renegade soldiers. ""President Vieira was killed by the army as he tried to flee his house which was being attacked by a group of soldiers close to the chief of staff Tagme Na Waie, early this morning,"" Zamora Induta, a military spokesman, said to Agence France-Presse, insisting that ""this was not a coup d'etat."""	Bernardo Vieira was the president of Guinea-Bissau.	1	"According to officials, João Bernardo Vieira, the president of Guinea-Bissau, was shot to death on Monday in his palace by renegade soldiers. ""President Vieira was killed by the army as he tried to flee his house which was being attacked by a group of soldiers close to the chief of staff Tagme Na Waie, early this morning,"" Zamora Induta, a military spokesman, said to Agence France-Presse, insisting that ""this was not a coup d'etat."""	Bernardo Vieira was the president of Guinea-Bissau.	0	1
49	Without a natural y effect, the temperature of the Earth would be about zero degrees F (-18C) instead of its present 57F (14C).	Greenhouse effect changes global climate.	1	Without a natural greenhouse effect, the temperature of the Earth would be about zero degrees F (-18C) instead of its present 57F (14C).	Greenhouse effect changes global climate.	0	1
50	NASA's two Great Observatories, the Hubble Space Telescope and the Chandra X-ray Observatory, have independently provided what could be the best direct evidence yet for the existence of an event horizon, the defining feature of a black hole.	Hubble discovers k holes.	1	NASA's two Great Observatories, the Hubble Space Telescope and the Chandra X-ray Observatory, have independently provided what could be the best direct evidence yet for the existence of an event horizon, the defining feature of a black hole.	Hubble discovers black holes.	0	1
51	Giuliana Sgrena was freed from captivity in Iraq today. The Italian journalist was abducted in Baghdad exactly a month ago while  she had been reporting for Il Manifesto. The Islamic Jihad Organisation had taken her hostage on the 4th February with the demand that Italy withdraw all of its troops from Iraq. On February 16, a video was released with a clearly distraught Mrs Sgrena begging for Italy to withdraw from Iraq. However despite the video, the Italian Senate voted to extend its miltary forces' stay in Iraq.	A t journalist was i in Iraq.	1	Giuliana Sgrena was freed from captivity in Iraq today. The Italian journalist was abducted in Baghdad exactly a month ago while  she had been reporting for Il Manifesto. The Islamic Jihad Organisation had taken her hostage on the 4th February with the demand that Italy withdraw all of its troops from Iraq. On February 16, a video was released with a clearly distraught Mrs Sgrena begging for Italy to withdraw from Iraq. However despite the video, the Italian Senate voted to extend its miltary forces' stay in Iraq.	A female journalist was kidnapped in Iraq.	0	1
52	Tropical Storm Irene on August 11, 2005 at 16:15 UTC. Tropical Storm Irene will increase in strength over the next several days, possibly developing into   a hurricane that will hit the east coast of the United States, said the National Hurricane Center of Miami, Florida in a report today.  Irene was located approximately 975 kilometers south-southeast of Bermuda at 16:00 UTC today. Forecasters say that the storm is now moving in a west-  northwest direction with top sustained winds of 40 miles per hour.	A i called Irene is c to approach the east o of the US.	1	Tropical Storm Irene on August 11, 2005 at 16:15 UTC. Tropical Storm Irene will increase in strength over the next several days, possibly developing into   a hurricane that will hit the east coast of the United States, said the National Hurricane Center of Miami, Florida in a report today.  Irene was located approximately 975 kilometers south-southeast of Bermuda at 16:00 UTC today. Forecasters say that the storm is now moving in a west-  northwest direction with top sustained winds of 40 miles per hour.	A storm called Irene is going to approach the east coast of the US.	0	1
53	One of the dead was a child, passing by with his parents, said Iqrar Abbasi, a doctor at Civil Hospital Karachi.	A doctor was a by his parents.	0	One of the dead was a child, passing by with his parents, said Iqrar Abbasi, a doctor at Civil Hospital Karachi.	A doctor was killed by his parents.	1	0
54	The Cyrillic alphabet is an alphabet used for several East and South Slavic languages; (Belarusian, Bulgarian, Macedonian, Russian, Rusyn, Serbian, and Ukrainian) and many other languages of the former Soviet Union, Asia and Eastern Europe. It has also been used for other languages in the past. Not all letters in the Cyrillic alphabet are used in every language which is written with it.	Cyrillic is an alphabet used for certain c languages, such as Russian.	1	The Cyrillic alphabet is an alphabet used for several East and South Slavic languages; (Belarusian, Bulgarian, Macedonian, Russian, Rusyn, Serbian, and Ukrainian) and many other languages of the former Soviet Union, Asia and Eastern Europe. It has also been used for other languages in the past. Not all letters in the Cyrillic alphabet are used in every language which is written with it.	Cyrillic is an alphabet used for certain Slavic languages, such as Russian.	0	1
55	In November 1990, the president announced that opposition political parties would be permitted to organize in 1991. Several new parties emerged, including the Democratic Republican Movement (MDR), the Liberal Party (LP), the Democratic and Socialist Party (PSD), and the Coalition for the Defense of the Republic (CDR).	Several new political c t.	1	In November 1990, the president announced that opposition political parties would be permitted to organize in 1991. Several new parties emerged, including the Democratic Republican Movement (MDR), the Liberal Party (LP), the Democratic and Socialist Party (PSD), and the Coalition for the Defense of the Republic (CDR).	Several new political parties emerged.	0	1
56	The Disneyland of Europe is located 20 miles east of Paris. Euro Disney is a huge complex with hotels, restaurants, shops and a nearby golf course apart from the actual theme park. It provides a much better experience than its American cousin thanks to the marvels of modern engineering.	Euro-Disney is an e Park.	1	The Disneyland of Europe is located 20 miles east of Paris. Euro Disney is a huge complex with hotels, restaurants, shops and a nearby golf course apart from the actual theme park. It provides a much better experience than its American cousin thanks to the marvels of modern engineering.	Euro-Disney is an Entertainment Park.	0	1
57	The chaotic situation unleashed in Bogota last night, with the assasination of Justice Carlos Valencia, began on 28 July in Medellin, when motorized paid assasins murdered third public order Judge Maria Elena Diaz.	Justice Carlos Valencia was o in Medellin.	0	The chaotic situation unleashed in Bogota last night, with the assasination of Justice Carlos Valencia, began on 28 July in Medellin, when motorized paid assasins murdered third public order Judge Maria Elena Diaz.	Justice Carlos Valencia was killed in Medellin.	1	0
