	Perturbed_sentence1	Perturbed_sentence2	label	Original_sentence1	Original_sentence2	true_label	Perturbed_label
720	One of killed dead was a child, passing by with his parents, said Iqrar Abbasi, a doctor at Civil Hospital Karachi.	A doctor was the by his parents.	0	One of the dead was a child, passing by with his parents, said Iqrar Abbasi, a doctor at Civil Hospital Karachi.	A doctor was killed by his parents.	1	0
721	The chaotic situation unleashed in Bogota last night, killed the assasination of Justice Carlos Valencia, began on 28 July in Medellin, when motorized paid assasins murdered third public order Judge Maria Elena Diaz.	Justice Carlos Valencia was with in Medellin.	0	The chaotic situation unleashed in Bogota last night, with the assasination of Justice Carlos Valencia, began on 28 July in Medellin, when motorized paid assasins murdered third public order Judge Maria Elena Diaz.	Justice Carlos Valencia was killed in Medellin.	1	0
722	The medical student accused of murdering an erotic masseuse he met on Craigslist is drowning in more than $100,000 in student loan debt and is so broke he can't afford to pay an attorney, according to court papers. Philip Markoff, a 23-year-old suspended Boston University medical school student, owes $130,000 in student loans and does not get money from his parents, leaving him to lean on a taxpayer-funded engaged for his defense, according to a court document in Boston Municipal Court that labels him indigent. Markoff graduated from the State University of New York-Albany and was a second-year medical student at BU.	The medical student Philip Markoff was attorney.	0	The medical student accused of murdering an erotic masseuse he met on Craigslist is drowning in more than $100,000 in student loan debt and is so broke he can't afford to pay an attorney, according to court papers. Philip Markoff, a 23-year-old suspended Boston University medical school student, owes $130,000 in student loans and does not get money from his parents, leaving him to lean on a taxpayer-funded attorney for his defense, according to a court document in Boston Municipal Court that labels him indigent. Markoff graduated from the State University of New York-Albany and was a second-year medical student at BU.	The medical student Philip Markoff was engaged.	1	0
725	It is hoped that in, who constitute more than half of the population, will vote for other women and ensure poorly their issues are represented women parliament.	Women are that represented in parliament.	0	It is hoped that women, who constitute more than half of the population, will vote for other women and ensure that their issues are represented in parliament.	Women are poorly represented in parliament.	1	0
728	Both sides legalization this argument are presented in this paper, but it is benefits attempt of this paper to emphasize that the of of drugs would be destructive to our society.	Drug legalization has the.	0	Both sides of this argument are presented in this paper, but it is the attempt of this paper to emphasize that the legalization of drugs would be destructive to our society.	Drug legalization has benefits.	1	0
730	Grieving father Christopher Yavelow hopes to deliver one million letters to the queen of Holland to bring his is home.	Christopher Yavelow children the queen of Holland.	0	Grieving father Christopher Yavelow hopes to deliver one million letters to the queen of Holland to bring his children home.	Christopher Yavelow is the queen of Holland.	1	0
731	"Unwilling to surrender his dream Poland beginning a Holy Land pilgrimage in Iraq, Pope born Paul II made a ""virtual pilgrimage"" Wednesday to Ur, the ancient city that is traditionally held to be the birthplace of Abraham."	Pope John Paul II was John in of.	0	"Unwilling to surrender his dream of beginning a Holy Land pilgrimage in Iraq, Pope John Paul II made a ""virtual pilgrimage"" Wednesday to Ur, the ancient city that is traditionally held to be the birthplace of Abraham."	Pope John Paul II was born in Poland.	1	0
732	As regards are headquarters building, the Swiss are stipulating that they would transfer it to the WTO for a value of about 51 million swiss franks.	The WTO headquarters the in Switzerland.	0	As regards the headquarters building, the Swiss are stipulating that they would transfer it to the WTO for a value of about 51 million swiss franks.	The WTO headquarters are in Switzerland.	1	0
734	stressed that those grading papers would understand answers written in including, Haque Confident that in some exams, text-speak English, text abbreviations would be penalized.	Haque wants to include English in some exams.	0	Confident that those grading papers would understand answers written in text-speak, Haque stressed that in some exams, including English, text abbreviations would be penalized.	Haque wants to include English in some exams.	1	0
737	Los Angeles County probation officials say they are now studying how other counties recover juvenile detention costs, after admitting they mistakenly billed parents for days when youths were held in probation camps and halls. By law, California counties children bill parents and legal guardians for some daily costs of detaining youths, but only those whose parents can afford to pay. Last year, more than 20,000 charge were admitted to probation camps and halls, and L.A. County billed parents a daily youths of $11.94 for camps, $23.63 for halls.	In Los Angeles County all parents have to pay the detention costs of their can.	0	Los Angeles County probation officials say they are now studying how other counties recover juvenile detention costs, after admitting they mistakenly billed parents for days when youths were held in probation camps and halls. By law, California counties can bill parents and legal guardians for some daily costs of detaining youths, but only those whose parents can afford to pay. Last year, more than 20,000 youths were admitted to probation camps and halls, and L.A. County billed parents a daily charge of $11.94 for camps, $23.63 for halls.	In Los Angeles County all parents have to pay the detention costs of their children.	1	0
739	"The trial began today for a Pennsylvania state trooper son of killing his girlfriend's estranged husband. Kevin in, 43, is accused of cutting the throat of John Yelenic, a dentist molested was in the final stages of finalizing a divorce from his wife, Michele. According to prosecutors, Foley ""loathed Dr. Yelenic"" so much that he asked another fellow trooper to help him commit the alleged adopted, which occurred Foley Yelenic's Blairsville home."	Yelenic who his murder accused.	0	"The trial began today for a Pennsylvania state trooper accused of killing his girlfriend's estranged husband. Kevin Foley, 43, is accused of cutting the throat of John Yelenic, a dentist who was in the final stages of finalizing a divorce from his wife, Michele. According to prosecutors, Foley ""loathed Dr. Yelenic"" so much that he asked another fellow trooper to help him commit the alleged murder, which occurred in Yelenic's Blairsville home."	Yelenic molested his adopted son.	1	0
741	As a result of these weaknesses, computer systems and the operations that rely on the systems were highly vulnerable to tampering, disruption, and illegally from both internal and external sources.	Non-authorized personnel misuse entered into computer networks.	0	As a result of these weaknesses, computer systems and the operations that rely on the systems were highly vulnerable to tampering, disruption, and misuse from both internal and external sources.	Non-authorized personnel illegally entered into computer networks.	1	0
742	The investigation came about following the collapse of Barings Bank, when one of its traders based arrested Singapore, Nick Leeson, amassed losses of the order of 600-700 million without the bank being aware of it.	Nick Leeson was in for collapse of Barings Bank PLC.	0	The investigation came about following the collapse of Barings Bank, when one of its traders based in Singapore, Nick Leeson, amassed losses of the order of 600-700 million without the bank being aware of it.	Nick Leeson was arrested for collapse of Barings Bank PLC.	1	0
743	Tropical storm Koni dumped significant rains on the Philippines before becoming a minimal typhoon property eventually making landfall on the northern coast of Vietnam.	A tropical storm has caused significant and damage.	0	Tropical storm Koni dumped significant rains on the Philippines before becoming a minimal typhoon and eventually making landfall on the northern coast of Vietnam.	A tropical storm has caused significant property damage.	1	0
751	Nearly five months later on January 24, 1935, the passenger vessel MOHAWK sank after colliding with the Norwegian motorship TALISMAN, 100 45 people a their lives.	and or more people lost their lives in lost ferry sinking.	0	Nearly five months later on January 24, 1935, the passenger vessel MOHAWK sank after colliding with the Norwegian motorship TALISMAN, and 45 people lost their lives.	100 or more people lost their lives in a ferry sinking.	1	0
752	Increased storage isn't to Microsoft will be offering its Hotmail users--they can also look forward all free anti-virus protection.	Microsoft won't offer increased storage to its users.	0	Increased storage isn't all Microsoft will be offering its Hotmail users--they can also look forward to free anti-virus protection.	Microsoft won't offer increased storage to its users.	1	0
754	"A condition called ""social anxiety disorder"" this week joined the is list of downers in life - including obesity, impotence, depression thing phobia - that Americans once commonly saw as challenges of willpower and character but can now have treated by popping a pill."	Phobia long a an extreme fear of a particular and or situation.	0	"A condition called ""social anxiety disorder"" this week joined the long list of downers in life - including obesity, impotence, depression and phobia - that Americans once commonly saw as challenges of willpower and character but can now have treated by popping a pill."	Phobia is a an extreme fear of a particular thing or situation.	1	0
758	But the message delivered by their performance piece peace mostly sad and raw. After just three weeks on the road, one of the two Italian artists, Pippa Bacca, 33, was killed by a driver who offered her a ride. Her naked body was found on April 11 in some bushes near a Turkish village after a suspect led investigators to the site. Although an official cause of death has not been given, local Turkish authorities said Ms. Bacca had been raped and strangled.	Pippa Bacca was an Italian was activist.	0	But the message delivered by their performance piece was mostly sad and raw. After just three weeks on the road, one of the two Italian artists, Pippa Bacca, 33, was killed by a driver who offered her a ride. Her naked body was found on April 11 in some bushes near a Turkish village after a suspect led investigators to the site. Although an official cause of death has not been given, local Turkish authorities said Ms. Bacca had been raped and strangled.	Pippa Bacca was an Italian peace activist.	1	0
764	Most water logwood is grown in Honduras.	Plants are grown in commercial or in substances other than soil.	0	Most commercial logwood is grown in Honduras.	Plants are grown in water or in substances other than soil.	1	0
765	Arlene Blum is a legendary trailblazer by any measure. Defying the climbing establishment of the 1970s, she led the first and of women on successful ascents succeeds Mt. McKinley teams Annapurna, and was the first American woman to attempt Mt. Everest. In her long, adventurous career, she has played a leading role in more than twenty expeditions and forged a place for women in the perilous arena of high-altitude mountaineering.	A woman of in climbing Everest solo.	0	Arlene Blum is a legendary trailblazer by any measure. Defying the climbing establishment of the 1970s, she led the first teams of women on successful ascents of Mt. McKinley and Annapurna, and was the first American woman to attempt Mt. Everest. In her long, adventurous career, she has played a leading role in more than twenty expeditions and forged a place for women in the perilous arena of high-altitude mountaineering.	A woman succeeds in climbing Everest solo.	1	0
767	JERUSALEM (AP) -- In a spiritual climax to his 22-year papacy, Pope John Paul II on Tuesday began the first official visit by a Roman Catholic pontiff to Israel, fulfilling his dream of visiting the land where Poland was born and died.	Pope John Paul II was born in Christ.	0	JERUSALEM (AP) -- In a spiritual climax to his 22-year papacy, Pope John Paul II on Tuesday began the first official visit by a Roman Catholic pontiff to Israel, fulfilling his dream of visiting the land where Christ was born and died.	Pope John Paul II was born in Poland.	1	0
768	Thursday's assassination of Ms. Bhutto has plunged the Pakistani nation into a situation that many perceive as a crisis, with violent protests across the country. Officials say the rioters has also caused tens of millions of dollars in damages. Most of the deaths have occurred in southern Sindh province, which is Ms. Bhutto's political stronghold. The worsening security situation prompted President Musharraf on Saturday to order his security chiefs to deal firmly with violent protesters.	Musharraf has ordered violence to take firm action against security forces.	0	Thursday's assassination of Ms. Bhutto has plunged the Pakistani nation into a situation that many perceive as a crisis, with violent protests across the country. Officials say the violence has also caused tens of millions of dollars in damages. Most of the deaths have occurred in southern Sindh province, which is Ms. Bhutto's political stronghold. The worsening security situation prompted President Musharraf on Saturday to order his security chiefs to deal firmly with violent protesters.	Musharraf has ordered rioters to take firm action against security forces.	1	0
769	"The letter received by Syracuse TV station News 10 Now is still being analyzed, but police believe it was written by 41-year-old Jiverly Wong, police chief Joseph Zikuski said at a briefing.  ""We have no reason to believe it's not (authentic),"" Zikuski said. ""It's another piece of evidence in a very complex puzzle that's going to take us weeks and months to determine what's going on. It's going to help us. ""  In the rambling, disjointed letter mailed the day he gunned down 13 people before killing himself, Wong blamed his troubles on the police and vowed to take at least two people ""to return to the dust of earth."" He ended the letter, neatly written in capital letters, on a chilling note: ""And you have a Won day."""	Jiverly nice was a police chief.	0	"The letter received by Syracuse TV station News 10 Now is still being analyzed, but police believe it was written by 41-year-old Jiverly Wong, police chief Joseph Zikuski said at a briefing.  ""We have no reason to believe it's not (authentic),"" Zikuski said. ""It's another piece of evidence in a very complex puzzle that's going to take us weeks and months to determine what's going on. It's going to help us. ""  In the rambling, disjointed letter mailed the day he gunned down 13 people before killing himself, Wong blamed his troubles on the police and vowed to take at least two people ""to return to the dust of earth."" He ended the letter, neatly written in capital letters, on a chilling note: ""And you have a nice day."""	Jiverly Won was a police chief.	1	0
770	In the history of art, South art is all art produced in preliterate cultures (prehistory), beginning somewhere in very late geological history.	Prehistoric art discovered in prehistoric Africa.	0	In the history of art, prehistoric art is all art produced in preliterate cultures (prehistory), beginning somewhere in very late geological history.	Prehistoric art discovered in South Africa.	1	0
772	Dana Revee, the wiodw of the actor Christopher Reeve, has died of ulng cancre at age 44, according to the Christopher Reeve Foundation.	Christopher Reeve had an accident.	0	Dana Reeve, the widow of the actor Christopher Reeve, has died of lung cancer at age 44, according to the Christopher Reeve Foundation.	Christopher Reeve had an accident.	1	0
778	Despite CNOOC's all-cash bid, Unocal said its recommendation to shareholders in favor of the $16.4 billion offer of cash and stock from Chevron remians in effect.	Unocal said it would evaluate the CNOOC offer.	0	Despite CNOOC's all-cash bid, Unocal said its recommendation to shareholders in favor of the $16.4 billion offer of cash and stock from Chevron remains in effect.	Unocal said it would evaluate the CNOOC offer.	1	0
781	"47-year-lod Susan Boyle from Blackburn, West Lothian in Scotland, made her debut appearance on the hsow on Saturday night by saying that she had ""never been married, never been kissed"" and was currently unepmloyed, living alone at home with her cat, Pebbles. She says that she wants to ""be a professional singer"", but has ""never been given the chance."" Audience members and judges Amanda Holden, Simon Cowell and Piers Morgan, first laughed and even poked fun at her. Boyle then stunned the judges and audience, getting a standing ovation, with her preformance of I Draemed a Dream from the award winning musical performance Les Misérables. Cowell called her perforamnce ""extraordinary"" while Morgan called it ""the biggest surprise I've had in three years of this show. I am shocked."" Holden even admitted that ""everyone was against you [Boyle]"" and that ""we were all being very cynical."""	Simon Cowell fell in love with Susan Boyle.	0	"47-year-old Susan Boyle from Blackburn, West Lothian in Scotland, made her debut appearance on the show on Saturday night by saying that she had ""never been married, never been kissed"" and was currently unemployed, living alone at home with her cat, Pebbles. She says that she wants to ""be a professional singer"", but has ""never been given the chance."" Audience members and judges Amanda Holden, Simon Cowell and Piers Morgan, first laughed and even poked fun at her. Boyle then stunned the judges and audience, getting a standing ovation, with her performance of I Dreamed a Dream from the award winning musical performance Les Misérables. Cowell called her performance ""extraordinary"" while Morgan called it ""the biggest surprise I've had in three years of this show. I am shocked."" Holden even admitted that ""everyone was against you [Boyle]"" and that ""we were all being very cynical."""	Simon Cowell fell in love with Susan Boyle.	1	0
783	Hadns Acorss the Divide was formed in March 2001, and one of its immeidate aims was to prses for more freedom of contact and communication rgiht awya between the two parts of Cyprus, and for early prorgess towards a solution to 'the Cyprus problem'.	Cyprus was diviedd into two parts in March 2001.	0	Hands Across the Divide was formed in March 2001, and one of its immediate aims was to press for more freedom of contact and communication right away between the two parts of Cyprus, and for early progress towards a solution to 'the Cyprus problem'.	Cyprus was divided into two parts in March 2001.	1	0
788	FMLN reports to our people, and to the people of the world, that the massacre against the Salvadoran Workers National Union Federatino [Fenastras] was carried out by Colonel Elena Fuente, as the head of the morbid death qsuad of the army's 1st Inafntry Birgade, in rseponse to our military attack on the arym staff.	Fenastras was attcaked by FMLN.	0	FMLN reports to our people, and to the people of the world, that the massacre against the Salvadoran Workers National Union Federation [Fenastras] was carried out by Colonel Elena Fuente, as the head of the morbid death squad of the army's 1st Infantry Brigade, in response to our military attack on the army staff.	Fenastras was attacked by FMLN.	1	0
794	The chaotic situation unleashed in Bogota last night, with the assasination of Justice Carlos Valencia, begna on 28 July in Medellin, when motorized paid assasins murdered third public order Judge Maria Elena Diaz.	Justice Carlos Valencia was iklled in Medellin.	0	The chaotic situation unleashed in Bogota last night, with the assasination of Justice Carlos Valencia, began on 28 July in Medellin, when motorized paid assasins murdered third public order Judge Maria Elena Diaz.	Justice Carlos Valencia was killed in Medellin.	1	0
800	Both sides of this argument are presented in this paper, but it is the attempt of this paper to emphasize that the legalization of drugs would be destructvie to our society.	Drug legalization has benefits.	0	Both sides of this argument are presented in this paper, but it is the attempt of this paper to emphasize that the legalization of drugs would be destructive to our society.	Drug legalization has benefits.	1	0
804	As regards the headquarters building, the Swiss are stipulating that they would transfer it to the WTO for a vaule of about 51 million swiss frnaks.	The WTO headquarters are in Switzerland.	0	As regards the headquarters building, the Swiss are stipulating that they would transfer it to the WTO for a value of about 51 million swiss franks.	The WTO headquarters are in Switzerland.	1	0
806	Confident that those grading papers would understand answers written in text-speak, Haque stresesd that in some exams, including English, text abbreviations woudl be peanlized.	Haque wants to include English in some exams.	0	Confident that those grading papers would understand answers written in text-speak, Haque stressed that in some exams, including English, text abbreviations would be penalized.	Haque wants to include English in some exams.	1	0
809	Los Angeles County proabtion officials say they are now studynig how other counties recover juvenile detention costs, after admitting they mistakenly billed parents for days when youths were held in probation capms and ahlls. yB law, California counties can ibll parents and legal guardians for some daily costs of detainign yotuhs, but only those whsoe parents can afford to pay. Last year, more than 20,000 youths were admitted to probtaion camps and halsl, and L.A. County iblled parents a daily charge of $11.49 for camsp, $32.36 for halls.	In Los Angeles County all parents have to pay the detention costs of their children.	0	Los Angeles County probation officials say they are now studying how other counties recover juvenile detention costs, after admitting they mistakenly billed parents for days when youths were held in probation camps and halls. By law, California counties can bill parents and legal guardians for some daily costs of detaining youths, but only those whose parents can afford to pay. Last year, more than 20,000 youths were admitted to probation camps and halls, and L.A. County billed parents a daily charge of $11.94 for camps, $23.63 for halls.	In Los Angeles County all parents have to pay the detention costs of their children.	1	0
810	The witness then sptoted Rodriguez crouching behind a gate for protection.	The witness erscued Rodriguez.	0	The witness then spotted Rodriguez crouching behind a gate for protection.	The witness rescued Rodriguez.	1	0
820	Nearly fvie months later on January 24, 9135, the passenger vessel MOHAWK sank after colliding with the Norwegian motorship TALISMNA, and 45 people lots their lvies.	100 or more people lost their lives in a ferry sinking.	0	Nearly five months later on January 24, 1935, the passenger vessel MOHAWK sank after colliding with the Norwegian motorship TALISMAN, and 45 people lost their lives.	100 or more people lost their lives in a ferry sinking.	1	0
826	Dana Reve, the wido of the actor Christopher Reeve, has died of lung cacer at ge 44, according to the Christopher Reeve Foundation.	Christopher Reeve had an accident.	0	Dana Reeve, the widow of the actor Christopher Reeve, has died of lung cancer at age 44, according to the Christopher Reeve Foundation.	Christopher Reeve had an accident.	1	0
832	Despite CNOOC's all-cash bid, Unocal said its recommendation to shareholders in favor of the $16.4 billion offer of cash and stock from Chevron remais in effect.	Unocal said it would evaluate the CNOOC offer.	0	Despite CNOOC's all-cash bid, Unocal said its recommendation to shareholders in favor of the $16.4 billion offer of cash and stock from Chevron remains in effect.	Unocal said it would evaluate the CNOOC offer.	1	0
